{
  "cases": [
    {
      "case_id": "msc-d3-smoke-clifft",
      "correctness": {
        "check_id": "aggregate-count-and-circuit-metadata-v1",
        "details": {
          "accepted_shots": 9,
          "attempted_shots": 16,
          "discarded_shots": 7,
          "duration_seconds": 0.000042708124965429306,
          "logical_errors": 0
        },
        "errors": [],
        "status": "passed",
        "timed_region": false
      },
      "error": null,
      "execution": {
        "batch_enabled": false,
        "batch_size": 1,
        "batch_size_effective": 1,
        "memory_limit_bytes": null,
        "min_sample_seconds": 0.01,
        "mode": "throughput",
        "postselection": true,
        "repetitions": 1,
        "request_timeout_seconds": 60,
        "sample_chunk_shots": 0,
        "shots_per_call": 64,
        "threads_effective": 1,
        "threads_requested": 1
      },
      "variant_id": "clifft-current",
      "samples": [
        {
          "accepted_shots": 7732,
          "adapter_timing_totals": {},
          "api_calls": 175,
          "attempted_shots": 11200,
          "discarded_shots": 3468,
          "duration_seconds": 0.010030707344412804,
          "logical_errors": 0,
          "repetition": 0,
          "seed_first": 20270808,
          "seed_last": 20270982,
          "sequence_index": 0,
          "started_at": "2026-08-08T00:00:00Z",
          "throughput_attempted_shots_per_second": 1116571.3060344148
        }
      ],
      "setup": {
        "adapter_version": "1",
        "affinity": {
          "applied": false,
          "available_after": null,
          "available_before": null,
          "logical_cpu": null,
          "reason": "no logical CPU requested on this platform",
          "requested": false
        },
        "duration_seconds": 0.022351207677274942,
        "runtime_metadata": {
          "address_space_limit_bytes": null,
          "batch_enabled": false,
          "compile_seconds": 0.000496583990752697,
          "cpu_baseline": "example",
          "effective_batch_size": 1,
          "name": "clifft",
          "num_detectors": 20,
          "num_measurements": 21,
          "num_observables": 1,
          "num_qubits": 15,
          "parse_seconds": 0.00007908325642347336,
          "peak_active_width": 4,
          "precision": "complex-fp64",
          "reference_convention": "raw-record-parity",
          "svm_backend": "example",
          "threads": 1,
          "version": "0.7.0"
        }
      },
      "simulator": {
        "adapter": "clifft",
        "build": {
          "compiler_flags": [],
          "features": [
            "CPU-only",
            "runtime CPU baseline recorded by adapter"
          ],
          "precision": "complex-fp64"
        },
        "commit_datetime": "2026-07-31T15:10:55Z",
        "commit_sha": "27085d10a6822a00eb0bbae9ac708ec13dd4de27",
        "dependencies": {
          "numpy": "2.5.1"
        },
        "implementation_id": "clifft-v0.7.0",
        "name": "clifft",
        "python_executable": "python",
        "release_datetime": "2026-07-31T15:28:45.643981Z",
        "source_url": "https://github.com/unitaryfoundation/clifft",
        "version": "0.7.0"
      },
      "status": "success",
      "summary": {
        "mad_attempted_shots_per_second": 0.0,
        "max_attempted_shots_per_second": 1116571.3060344148,
        "median_attempted_shots_per_second": 1116571.3060344148,
        "min_attempted_shots_per_second": 1116571.3060344148,
        "sample_count": 1,
        "total_attempted_shots": 11200,
        "total_duration_seconds": 0.010030707344412804
      },
      "warmup": {
        "accepted_shots": 4,
        "attempted_shots": 4,
        "contract_errors": [],
        "discarded_shots": 0,
        "duration_seconds": 0.00005320832133293152,
        "logical_errors": 0
      },
      "workload": {
        "artifact": {
          "path": "workloads/circuits/msc_d3_inject_cultivate_p1e-3.stim",
          "sha256": "90a7d841e003e5ee38137cd9a3eb6529bb552e49c424bc6b0932a27d97cdb41f"
        },
        "family": "magic-state-cultivation",
        "id": "msc-d3-inject-cultivate-p1e-3",
        "parameters": {
          "distance": 3,
          "physical_error_rate": 0.001,
          "stages": [
            "injection",
            "cultivation"
          ]
        },
        "provenance": {
          "license": "Apache-2.0",
          "notes": "Byte-for-byte copy of the paper workload.",
          "source_commit": "db7dc9f13a2c2854690e92390c779048a1ac1400",
          "source_path": "qec_bench/circuits/cultivation_d3.stim",
          "source_url": "https://github.com/unitaryfoundation/clifft-paper"
        },
        "semantics": {
          "batch_semantics": "A batch contains independent shots and changes throughput amortization only; every attempted shot remains one unit of logical work.",
          "logical_work": "Sample the complete circuit once per attempted shot; discard any shot with a detector event and count observable-0 parity among survivors.",
          "observable_index": 0,
          "output_contract": "aggregate detector-discard and logical-observable counts",
          "postselect_all_detectors": true,
          "reference_convention": "raw-record-parity",
          "throughput_numerator": "attempted shots"
        }
      }
    }
  ],
  "run": {
    "classification": "smoke",
    "finished_at": "2026-08-08T00:00:01Z",
    "id": "00000000-0000-4000-8000-000000000001",
    "profile_id": "adapter-smoke",
    "run_manifest": "manifests/run-smoke.v1.json",
    "schedule_policy": "serial-manifest-order",
    "selection": "^msc-d3-smoke-clifft$",
    "software_manifest": "manifests/software.v1.json",
    "started_at": "2026-08-08T00:00:00Z",
    "workflow": {
      "image_os": null,
      "image_version": null,
      "provider": null,
      "ref": null,
      "repository": null,
      "run_attempt": null,
      "run_id": null,
      "runner_name": null,
      "runner_os": null,
      "sha": null,
      "workflow": null
    },
    "workloads_manifest": "manifests/workloads.v1.json"
  },
  "runner": {
    "accelerator": null,
    "cloud": null,
    "allowed_logical_cpus": [
      0
    ],
    "cpu_model": "Example x86-64 CPU",
    "hostname": "example-runner",
    "kernel_version": "example",
    "load_average_at_start": [
      0.1,
      0.1,
      0.1
    ],
    "logical_cpus": 8,
    "machine": "x86_64",
    "memory_bytes": 17179869184,
    "os": "Example OS",
    "os_release": "example",
    "physical_cores": 4,
    "python": "3.12.0",
    "python_compiler": "Example compiler",
    "suite_source": {
      "commit": null,
      "dirty": false
    },
    "thread_environment": {
      "BLIS_NUM_THREADS": "1",
      "JAX_DEFAULT_MATMUL_PRECISION": "highest",
      "JAX_ENABLE_X64": "true",
      "JAX_PLATFORMS": "cpu",
      "MKL_NUM_THREADS": "1",
      "NUMEXPR_NUM_THREADS": "1",
      "OMP_NUM_THREADS": "1",
      "OPENBLAS_NUM_THREADS": "1",
      "VECLIB_MAXIMUM_THREADS": "1",
      "XLA_FLAGS": "--xla_cpu_multi_thread_eigen=false intra_op_parallelism_threads=1",
      "XLA_PYTHON_CLIENT_PREALLOCATE": "false"
    }
  },
  "schema_version": "clifft-bench/result/v1",
  "suite_version": "0.2.1"
}
